android.permission.SIGNAL_PERSISTENT_PROCESSES,Permission,Allow an application to request that a signal be sent to all persistent processes.
android.permission.STATUS_BAR,Permission,"Allows an application to open, close, or disable the status bar and its icons."
android.permission.SYSTEM_ALERT_WINDOW,Permission,"Allows an app to create windows using the type WindowManager.LayoutParams."
android.permission.TRANSMIT_IR,Permission,"Allows using the device's IR transmitter, if available."
android.permission.UNINSTALL_SHORTCUT,Permission,Don't use this permission in your app.
android.permission.UPDATE_DEVICE_STATS,Permission,Allows an application to update device statistics.
android.permission.USE_BIOMETRIC,Permission,Allows an app to use device supported biometric modalities.
android.permission.USE_FINGERPRINT,Permission,This constant was deprecated in API level 28.
android.permission.USE_SIP,Permission,Allows an application to use SIP service.
android.permission.VIBRATE,Permission,Allows access to the vibrator.
android.permission.WAKE_LOCK,Permission,Allows using PowerManager WakeLocks to keep processor from sleeping or screen from dimming.
android.permission.WRITE_APN_SETTINGS,Permission,Allows applications to write the apn settings.
android.permission.WRITE_CALENDAR,Permission,Allows an application to write the user's calendar data.
android.permission.WRITE_CALL_LOG,Permission,Allows an application to write (but not read) the user's call log data.
android.permission.WRITE_CONTACTS,Permission,Allows an application to write the user's contacts data.
android.permission.WRITE_EXTERNAL_STORAGE,Permission,Allows an application to write to external storage.
android.permission.WRITE_GSERVICES,Permission,Allows an application to modify the Google service map.
android.permission.WRITE_SECURE_SETTINGS,Permission,Allows an application to read or write the secure system settings.
android.permission.WRITE_SETTINGS,Permission,Allows an application to read or write the system settings.
android.permission.WRITE_SYNC_SETTINGS,Permission,Allows applications to write the sync settings.
android.permission.WRITE_VOICEMAIL,Permission,Allows an application to modify and remove existing voicemails in the system.
